{
  "format_version": 2,
  "id": "plan-ponto-de-virada",
  "mission_id": "definido-pelo-intake",
  "immutable_digest": "0123456789abcdef",
  "authorization": { "autonomy": "safe", "permitted_effects": [], "eligible_skills": [] },
  "phases": [{ "epics": [{ "stories": ["PV-1"] }] }],
  "mission_budget": { "max_usd": 300, "max_wall_clock_seconds": 3600, "max_parked_units": 1, "max_subscription_weekly_percent": 20 },
  "budget": { "max_model_calls": 6, "max_rework_rounds": 2 }
}
